{
  "states": [
    "Idle",
    "CreditAvailable",
    "Dispensing"
  ],
  "initial_state": "Idle",
  "events": [
    "insert_coin",
    "press_coffee",
    "press_tea",
    "cancel",
    "dispense_complete"
  ],
  "system_name": "Drink Vending Machine",
  "domain": "vending machine",
  "variables": [
    {
      "name": "creditStored",
      "type": "boolean",
      "initial": false
    },
    {
      "name": "selectedDrink",
      "type": "enum",
      "values": [
        "NONE",
        "COFFEE",
        "TEA"
      ],
      "initial": "NONE"
    }
  ],
  "transitions": [
    {
      "source": "Idle",
      "event": "insert_coin",
      "target": "CreditAvailable",
      "updates": {
        "creditStored": "true"
      },
      "requirement": "R2"
    },
    {
      "source": "Idle",
      "event": "press_coffee",
      "target": "Idle",
      "requirement": "R5"
    },
    {
      "source": "Idle",
      "event": "press_tea",
      "target": "Idle",
      "requirement": "R5"
    },
    {
      "source": "Idle",
      "event": "cancel",
      "target": "Idle",
      "requirement": "R8"
    },
    {
      "source": "CreditAvailable",
      "event": "insert_coin",
      "target": "CreditAvailable",
      "updates": {
        "creditStored": "true"
      },
      "outputs": [
        "REJECT_COIN"
      ],
      "requirement": "R12"
    },
    {
      "source": "CreditAvailable",
      "event": "press_coffee",
      "target": "Dispensing",
      "updates": {
        "selectedDrink": "COFFEE"
      },
      "outputs": [
        "DISPENSE_COFFEE"
      ],
      "requirement": "R3"
    },
    {
      "source": "CreditAvailable",
      "event": "press_tea",
      "target": "Dispensing",
      "updates": {
        "selectedDrink": "TEA"
      },
      "outputs": [
        "DISPENSE_TEA"
      ],
      "requirement": "R4"
    },
    {
      "source": "CreditAvailable",
      "event": "cancel",
      "target": "Idle",
      "updates": {
        "creditStored": "false",
        "selectedDrink": "NONE"
      },
      "outputs": [
        "RETURN_COIN"
      ],
      "requirement": "R7"
    },
    {
      "source": "Dispensing",
      "event": "press_coffee",
      "target": "Dispensing",
      "requirement": "R9"
    },
    {
      "source": "Dispensing",
      "event": "press_tea",
      "target": "Dispensing",
      "requirement": "R9"
    },
    {
      "source": "Dispensing",
      "event": "cancel",
      "target": "Dispensing",
      "requirement": "R13"
    },
    {
      "source": "Dispensing",
      "event": "dispense_complete",
      "target": "Idle",
      "updates": {
        "creditStored": "false",
        "selectedDrink": "NONE"
      },
      "requirement": "R6"
    }
  ]
}